{
  "schema_version": 1,
  "fixture_kind": "libpod-cassette",
  "scenario_id": "captured-mixed-origin-6.1.0-rootful",
  "scenario_revision": 1,
  "engine_version": "6.1.0",
  "api_version": "6.1.0",
  "execution_context": "rootful",
  "synthetic": false,
  "provenance": {
    "evidence_kind": "privacy-reviewed-one-off-native-capture",
    "release_tag": "v6.1.0",
    "revision": "cade97a52ebdf9dbf9e81de8009015776837a074",
    "source_urls": [
      "https://github.com/containers/podman/tree/cade97a52ebdf9dbf9e81de8009015776837a074/pkg/api/handlers/libpod",
      "https://github.com/Strukturpiloten/boxferry/blob/52b7600afe936b3c688294bd9a7f43e1afa9bf1f/fixtures/conformance/podman-live/matrix.tsv",
      "https://github.com/docker/compose/releases/tag/v5.5.0"
    ],
    "capture": {
      "engine_build": {
        "kind": "source-build",
        "source_revision": "cade97a52ebdf9dbf9e81de8009015776837a074"
      },
      "runtime_image": "ghcr.io/strukturpiloten/podman-6.1-rootful:v6.1.0@sha256:2cf1d0fa3d0776e6a87bc4fd3391abd227001ab22885c5897c04970f3f38cb2c",
      "capture_manifest_sha256": "92020331b1ae8f6817536c9fba3fc2780e57df5e0358694e7d625ab95800f7e2",
      "runtime_repository": "https://github.com/Strukturpiloten/boxferry",
      "runtime_revision": "52b7600afe936b3c688294bd9a7f43e1afa9bf1f",
      "runtime_matrix_cell": "podman-6.1-rootful",
      "runtime_matrix_sha256": "1ed306f4b368c229bca927697156e2314b922c2ec728c55c2820c69a712bad25",
      "setup_script_sha256": "0790eb18744c8683a538c1917fc5a550b70e8a5dfb1f2448110101422dfae977",
      "request_recorder_source_sha256": "26a1b238826315326057e0d555c385ea5a4617568c8cd4154a5faa9d0ff7fb91",
      "compose_provider_binary_sha256": "abdf6ec2a49e5cb1f021f142d55a7494c823b11fa6f950237301a1cb70b5e5c6"
    }
  },
  "sanitization": "Captured from a disposable rootful runtime with no host socket or repository mount. Identifiers, names, paths, environment values, timestamps, request references, IPv4, IPv6, MAC and image evidence were deterministically replaced. Response Content-Length was recomputed after sanitization and decoded transfer responses were normalized to Content-Length. SecretData and Authorization objects are rejected.",
  "interactions": [
    {
      "request": {
        "method": "GET",
        "path": "/libpod/_ping"
      },
      "response": {
        "status": 200,
        "headers": [
          [
            "Api-Version",
            "1.44"
          ],
          [
            "Builder-Version",
            "1"
          ],
          [
            "Buildkit-Version",
            ""
          ],
          [
            "Cache-Control",
            "no-cache"
          ],
          [
            "Docker-Experimental",
            "true"
          ],
          [
            "Libpod-Api-Version",
            "6.1.0"
          ],
          [
            "Libpod-Buildah-Version",
            "1.45.0"
          ],
          [
            "Ostype",
            "linux"
          ],
          [
            "Pragma",
            "no-cache"
          ],
          [
            "Server",
            "Libpod/6.1.0 (linux)"
          ],
          [
            "X-Reference-Id",
            "fixture-reference-mixed-origin-01"
          ],
          [
            "Date",
            "Sat, 01 Jan 2000 00:00:00 GMT"
          ],
          [
            "Content-Length",
            "2"
          ],
          [
            "Content-Type",
            "text/plain; charset=utf-8"
          ],
          [
            "Connection",
            "close"
          ]
        ],
        "body_text": "OK"
      }
    },
    {
      "request": {
        "method": "GET",
        "path": "/v4.0.0/libpod/version"
      },
      "response": {
        "status": 200,
        "headers": [
          [
            "Api-Version",
            "1.44"
          ],
          [
            "Content-Type",
            "application/json"
          ],
          [
            "Libpod-Api-Version",
            "6.1.0"
          ],
          [
            "Server",
            "Libpod/6.1.0 (linux)"
          ],
          [
            "X-Reference-Id",
            "fixture-reference-mixed-origin-02"
          ],
          [
            "Date",
            "Sat, 01 Jan 2000 00:00:00 GMT"
          ],
          [
            "Content-Length",
            "1005"
          ],
          [
            "Connection",
            "close"
          ]
        ],
        "body": {
          "Platform": {
            "Name": "linux/amd64/fedora-44"
          },
          "Components": [
            {
              "Name": "Podman Engine",
              "Version": "6.1.0",
              "Details": {
                "APIVersion": "6.1.0",
                "Arch": "amd64",
                "BuildTime": "2000-01-01T00:00:00Z",
                "Experimental": "false",
                "GitCommit": "cade97a52ebdf9dbf9e81de8009015776837a074",
                "GoVersion": "go1.26.6-X:nodwarf5",
                "KernelVersion": "7.2.2-1-default",
                "MinAPIVersion": "4.0.0",
                "Os": "linux"
              }
            },
            {
              "Name": "Conmon",
              "Version": "conmon version 2.2.1, commit: ",
              "Details": {
                "Package": "conmon-2.2.1-2.fc44.x86_64"
              }
            },
            {
              "Name": "OCI Runtime (crun)",
              "Version": "crun version 1.28\ncommit: 54f16ffbefcd022bf032af768b5c5ce075c18bfc\nrundir: /run/crun\nspec: 1.0.0\n+SYSTEMD +SELINUX +APPARMOR +CAP +SECCOMP +EBPF +CRIU +LIBKRUN +WASM:wasmedge +JSON_C",
              "Details": {
                "Package": "crun-1.28-1.fc44.x86_64"
              }
            }
          ],
          "Version": "6.1.0",
          "ApiVersion": "1.44",
          "MinAPIVersion": "1.24",
          "GitCommit": "cade97a52ebdf9dbf9e81de8009015776837a074",
          "GoVersion": "go1.26.6-X:nodwarf5",
          "Os": "linux",
          "Arch": "amd64",
          "KernelVersion": "7.2.2-1-default",
          "BuildTime": "2000-01-01T00:00:00Z"
        }
      }
    },
    {
      "request": {
        "method": "GET",
        "path": "/v6.1.0/libpod/containers/json?all=true&sync=true"
      },
      "response": {
        "status": 200,
        "headers": [
          [
            "Api-Version",
            "1.44"
          ],
          [
            "Content-Type",
            "application/json"
          ],
          [
            "Libpod-Api-Version",
            "6.1.0"
          ],
          [
            "Server",
            "Libpod/6.1.0 (linux)"
          ],
          [
            "X-Reference-Id",
            "fixture-reference-mixed-origin-03"
          ],
          [
            "Date",
            "Sat, 01 Jan 2000 00:00:00 GMT"
          ],
          [
            "Connection",
            "close"
          ],
          [
            "Content-Length",
            "2748"
          ]
        ],
        "body": [
          {
            "AutoRemove": false,
            "Command": [
              "fixture-post-image-command"
            ],
            "Created": "2000-01-01T00:00:00Z",
            "CreatedAt": "2000-01-01T00:00:00Z",
            "CIDFile": "",
            "Exited": false,
            "ExitedAt": -62135596800,
            "ExitCode": 0,
            "ExposedPorts": null,
            "Id": "2222222222222222222222222222222222222222222222222222222222222222",
            "Image": "localhost/fixture-authored:1",
            "ImageID": "5555555555555555555555555555555555555555555555555555555555555555",
            "IsInfra": false,
            "Labels": {
              "io.buildah.version": "1.45.0",
              "org.strukturpiloten.fixture": "podman27-native-evidence"
            },
            "Mounts": [
              "/data"
            ],
            "Names": [
              "fixture-cli-authored"
            ],
            "Namespaces": {},
            "Networks": [],
            "Pid": 0,
            "Pod": "",
            "PodName": "",
            "Ports": null,
            "Restarts": 0,
            "Size": null,
            "StartedAt": 946684800,
            "State": "created",
            "Status": ""
          },
          {
            "AutoRemove": false,
            "Command": [
              "/bin/false"
            ],
            "Created": "2000-01-01T00:00:00Z",
            "CreatedAt": "2000-01-01T00:00:00Z",
            "CIDFile": "",
            "Exited": false,
            "ExitedAt": -62135596800,
            "ExitCode": 0,
            "ExposedPorts": null,
            "Id": "3333333333333333333333333333333333333333333333333333333333333333",
            "Image": "docker.io/library/fixture-native-evidence:fixture",
            "ImageID": "5555555555555555555555555555555555555555555555555555555555555555",
            "IsInfra": false,
            "Labels": {
              "io.buildah.version": "1.45.0",
              "org.strukturpiloten.fixture": "podman27-native-evidence"
            },
            "Mounts": [
              "/data"
            ],
            "Names": [
              "fixture-cli-tagged"
            ],
            "Namespaces": {},
            "Networks": [],
            "Pid": 0,
            "Pod": "",
            "PodName": "",
            "Ports": null,
            "Restarts": 0,
            "Size": null,
            "StartedAt": 946684800,
            "State": "created",
            "Status": ""
          },
          {
            "AutoRemove": false,
            "Command": [
              "fixture-provider-command"
            ],
            "Created": "2000-01-01T00:00:00Z",
            "CreatedAt": "2000-01-01T00:00:00Z",
            "CIDFile": "",
            "Exited": false,
            "ExitedAt": -62135596800,
            "ExitCode": 0,
            "ExposedPorts": null,
            "Id": "1111111111111111111111111111111111111111111111111111111111111111",